<?xml version="1.0" encoding="UTF-8"?>
<minx:DataTransferJob xmlns:xsi='http://www.w3.org/2001/XMLSchema-instance'
	xmlns:minx='http://dataMinx.xml.org/schema/2008/dataMinx'
	xsi:schemaLocation='http://dataMinx.xml.org/schema/2008/dataMinx MINX-DTS-Job.xsd'>
	<minx:JobName>my post data collection file transfer job </minx:JobName>
	<minx:Description>move from my home to lab Ozzy SRS </minx:Description>
	<minx:JobProject>my minx project </minx:JobProject>
	<minx:DataTransfer name="transfer_1">
		<minx:CreationFlag>overwrite</minx:CreationFlag>
		<minx:Source>
			<minx:URI>srb://srb1.ngs.ac.uk/home/dave/dir</minx:URI>
			<minx:Credential />
			<minx:SrbURIProperties>
				<minx:HomeDirectory>/home/whatever</minx:HomeDirectory>
				<minx:DefaultResource>srb1.ngs.ac.uk</minx:DefaultResource>
				<minx:PortRange>
					<minx:portMin>6400</minx:portMin>
					<minx:portMax>6500</minx:portMax>
				</minx:PortRange>
			</minx:SrbURIProperties>
		</minx:Source>
		<minx:Target>
			<minx:URI>ftp://ftp1.ngs.ac.uk/home/dave/stage</minx:URI>
			<minx:Credential />
		</minx:Target>
	</minx:DataTransfer>
	<minx:DataTransfer name="transfer_2">
		<minx:FileName>myfile.dat</minx:FileName>
		<minx:CreationFlag>append</minx:CreationFlag>
		<minx:Source>
			<minx:URI>srb://srb1.ngs.ac.uk/home/dave/dir</minx:URI>
			<minx:Credential />
		</minx:Source>
		<minx:Target>
			<minx:URI>gsiftp://ftp1.ngs.ac.uk/home/dave/stage</minx:URI>
			<minx:Credential />
			<minx:GridFtpURIProperties>
				<minx:PortRange>
					<minx:portMin>6400</minx:portMin>
					<minx:portMax>6500</minx:portMax>
				</minx:PortRange>
			</minx:GridFtpURIProperties>
		</minx:Target>
	</minx:DataTransfer>
</minx:DataTransferJob>